{"dimension_presence":{"decisional":{"observation_count":3,"status":"observed"},"epistemic":{"observation_count":2,"status":"observed"},"rhetorical":{"observation_count":3,"status":"observed"},"semantic":{"observation_count":1,"status":"observed"}},"measurements":{"advanced_stylometry":{"reason_code":"OUT_OF_SCOPE_V1","status":"not_computed","value":null},"nonblank_lines":137,"scope":"raw_markdown_body","unicode_code_points":9323,"utf8_bytes":9377},"method":{"instructions_hash":"6fb281e871a48583b9ed9d9780973f2997e27d00cd11ecbcbb509f2af6ed5c22","instructions_version":"author-extractor/1.1","measurement_version":"raw-body-counts/1","prepare_version":"prepare/1","schema_hash":"063c71461104299b4cfae449d1c32f24642c76fcfe0d9a8340a7023a48fa1047","segmentation_version":"raw-blank-lines/1"},"observations":[{"description":"The article explicitly qualifies its preceding catastrophic examples as possibly exaggerated.","dimension":"rhetorical","evidence":[{"article_id":"A12","passage_id":"P0002","quote":"Ok forse ho un po' esagerato, magari non parliamo di eventi così catastrofici"}],"id":"A12::O0001","inference_kind":"explicit","label":"Qualification of catastrophic examples","review_status":"unreviewed"},{"description":"The adjacent question and answer frame globally shared shell history as the central problem of the tutorial.","dimension":"rhetorical","evidence":[{"article_id":"A12","passage_id":"P0005","quote":"Ma qual è il problema?"},{"article_id":"A12","passage_id":"P0006","quote":"La history della shell è globale per default. Questo è il problema."}],"id":"A12::O0002","inference_kind":"inferred","label":"Question-and-answer problem framing","review_status":"unreviewed"},{"description":"The article defines its proposed project-level history separation by the root of the current Git repository.","dimension":"semantic","evidence":[{"article_id":"A12","passage_id":"P0007","quote":"La soluzione più pratica che ho trovato è **separare la history per progetto**, usando come discrimine la _root_ del {% xlink \"https://git-scm.com/\" \"repository git\" role=\"prerequisite\" context=\"provides-context\" target=\"external-authoritative\" sameAs=\"https://www.wikidata.org/wiki/Q186055\" %} in cui vi trovate."}],"id":"A12::O0003","inference_kind":"explicit","label":"Project boundary by repository root","review_status":"unreviewed"},{"description":"The article presents being at a Git repository root while repeatedly recalling commands as a probable development-context assumption.","dimension":"epistemic","evidence":[{"article_id":"A12","passage_id":"P0007","quote":"Questo perché è abbastanza sano ipotizzare che, se state consumando il pulsante freccia-su sulla tastiera, è perché state sviluppando qualcosa, e quindi con ogni probabilità siete nella root di un repository git."}],"id":"A12::O0004","inference_kind":"explicit","label":"Probabilistic repository premise","review_status":"unreviewed"},{"description":"The article specifies the current directory as the fallback history key outside a Git repository.","dimension":"decisional","evidence":[{"article_id":"A12","passage_id":"P0019","quote":"Altrimenti, si usa la directory corrente come chiave."},{"article_id":"A12","passage_id":"P0008","quote":"Tuttavia, se non siete in un repo git, si ripiega sulla directory corrente."}],"id":"A12::O0005","inference_kind":"explicit","label":"Current-directory fallback","review_status":"unreviewed"},{"description":"The article reports a personal choice of `SHARE_HISTORY` for immediate availability across sessions.","dimension":"decisional","evidence":[{"article_id":"A12","passage_id":"P0015","quote":"Io personalmente uso `SHARE_HISTORY` perché mi piace che tutto sia immediatamente disponibile ovunque, ma è questione di gusti."}],"id":"A12::O0006","inference_kind":"explicit","label":"Immediate history-sharing preference","review_status":"unreviewed"},{"description":"The article recommends replacing `SHARE_HISTORY` with `setopt INC_APPEND_HISTORY_TIME` when session isolation until closure is preferred.","dimension":"decisional","evidence":[{"article_id":"A12","passage_id":"P0015","quote":"Altrimenti, se preferite che ogni sessione sia isolata finché non la chiudete, sostituitela con `setopt INC_APPEND_HISTORY_TIME`."}],"id":"A12::O0007","inference_kind":"explicit","label":"Session-isolation alternative","review_status":"unreviewed"},{"description":"The article characterizes saving history on terminal closure or interruption as a safety provision rather than a strict necessity.","dimension":"epistemic","evidence":[{"article_id":"A12","passage_id":"P0050","quote":"E per sicurezza, salviamo la history anche quando il terminale viene chiuso o interrotto:"},{"article_id":"A12","passage_id":"P0053","quote":"Non è strettamente indispensabile perché `fc -W` viene già chiamato a ogni `chpwd`, ma non si sa mai."}],"id":"A12::O0008","inference_kind":"explicit","label":"Nonessential safety provision","review_status":"unreviewed"},{"description":"The closing repeated upward-key imagery echoes the opening account of laborious command recall.","dimension":"rhetorical","evidence":[{"article_id":"A12","passage_id":"P0002","quote":"ritrovarci ad andare indietro...e indietro...e indietro...insomma, ci siamo capiti."},{"article_id":"A12","passage_id":"P0062","quote":"Nel frattempo, mano destra sulla tastiera e cominciate a premere che il comando che vi serve rilanciare è proprio lì sopra...su...su...su...su..."}],"id":"A12::O0009","inference_kind":"inferred","label":"Closing command-recall echo","review_status":"unreviewed"}],"processing":{"passages_failed":null,"passages_processed":null,"passages_total":62,"passages_with_observations":10,"status":"not_tracked"},"schema_version":"author-extraction/1.1","source":{"article_id":"A12","corpus_hash":"31ab2684da116696a53686fafa0dbe0adee6d6a3532d50ce4bde03e89cdc7d40","file_hash":"836105877667f1412803479c93c3891cbb8a9adf52d888f2c4d4f8b97c724e24","path":"_posts/devops/2026-05-27-una-shell-history-per-ogni-progetto.md"}}