{"dimension_presence":{"decisional":{"observation_count":2,"status":"observed"},"epistemic":{"observation_count":2,"status":"observed"},"rhetorical":{"observation_count":2,"status":"observed"},"semantic":{"observation_count":2,"status":"observed"}},"measurements":{"advanced_stylometry":{"reason_code":"OUT_OF_SCOPE_V1","status":"not_computed","value":null},"nonblank_lines":74,"scope":"raw_markdown_body","unicode_code_points":8667,"utf8_bytes":8731},"method":{"instructions_hash":"6fb281e871a48583b9ed9d9780973f2997e27d00cd11ecbcbb509f2af6ed5c22","instructions_version":"author-extractor/1.1","measurement_version":"raw-body-counts/1","prepare_version":"prepare/1","schema_hash":"063c71461104299b4cfae449d1c32f24642c76fcfe0d9a8340a7023a48fa1047","segmentation_version":"raw-blank-lines/1"},"observations":[{"description":"The repeated formulation about what electrons do frames their behavior as ordinary rather than strange within this introduction.","dimension":"rhetorical","evidence":[{"article_id":"A05","passage_id":"P0004","quote":"Gli elettroni fanno quello che gli elettroni fanno. Ed è del tutto logico e normale (dal loro punto di vista)."}],"id":"A05::O0001","inference_kind":"inferred","label":"Normalizing repetition","review_status":"unreviewed"},{"description":"The article presents the English meaning of bra-ket as a mnemonic for distinguishing space from dual space.","dimension":"rhetorical","evidence":[{"article_id":"A05","passage_id":"P0051","quote":"Notate che i due vettori messi insieme fanno un bra-ket (\"parentesi\" in inglese): un modo mnemonico molto utile per non confondersi tra spazio e spazio duale!"}],"id":"A05::O0002","inference_kind":"explicit","label":"Bra-ket mnemonic","review_status":"unreviewed"},{"description":"The article asks readers to trust mathematics rather than expect intuitive understanding of quantum-scale phenomena.","dimension":"epistemic","evidence":[{"article_id":"A05","passage_id":"P0002","quote":"quando ragioniamo su scala quantistica dobbiamo abbandonare la pretesa di poter comprendere intuitivamente i fenomeni e fidarci della matematica."}],"id":"A05::O0003","inference_kind":"explicit","label":"Mathematics over intuition","review_status":"unreviewed"},{"description":"The article characterizes the quantum nature of reality as more than demonstrated.","dimension":"epistemic","evidence":[{"article_id":"A05","passage_id":"P0006","quote":"Ma non bisogna mai dimenticare che la realtà, è più che dimostrato, è decisamente __quantistica__."}],"id":"A05::O0004","inference_kind":"explicit","label":"Asserted demonstration","review_status":"unreviewed"},{"description":"The article specifies that its definition of vector is abstract.","dimension":"semantic","evidence":[{"article_id":"A05","passage_id":"P0011","quote":"È, però, importante segnalare che la nostra definizione di vettore va intesa in senso astratto."}],"id":"A05::O0005","inference_kind":"explicit","label":"Abstract vector meaning","review_status":"unreviewed"},{"description":"The article disambiguates complex vectors as vectors with components in the complex domain rather than complicated vectors.","dimension":"semantic","evidence":[{"article_id":"A05","passage_id":"P0013","quote":"sono dei vettori _generalmente complessi_ (nel senso che sono vettori le cui componenti sono nel dominio complesso, non che sono vettori complicati!)."}],"id":"A05::O0006","inference_kind":"explicit","label":"Complex-number disambiguation","review_status":"unreviewed"},{"description":"The article declines to explain what a vector is on the stated assumption that readers already know.","dimension":"decisional","evidence":[{"article_id":"A05","passage_id":"P0011","quote":"Non voglio scendere nel dettaglio di cosa sia un _vettore_, do per scontato che lo sappiate già."}],"id":"A05::O0007","inference_kind":"explicit","label":"Vector-definition omission","review_status":"unreviewed"},{"description":"The article explicitly opts not to demonstrate its claim that the state space is a Hilbert space.","dimension":"decisional","evidence":[{"article_id":"A05","passage_id":"P0018","quote":"Poiché si può dimostrare (non lo faremo) che lo spazio degli stati è uno spazio di Hilbert, esso è chiuso all'addizione."}],"id":"A05::O0008","inference_kind":"explicit","label":"Hilbert-space proof omission","review_status":"unreviewed"}],"processing":{"passages_failed":null,"passages_processed":null,"passages_total":68,"passages_with_observations":7,"status":"not_tracked"},"schema_version":"author-extraction/1.1","source":{"article_id":"A05","corpus_hash":"31ab2684da116696a53686fafa0dbe0adee6d6a3532d50ce4bde03e89cdc7d40","file_hash":"42915ee6b22d7ac0221ced6780a252a19510955a6b613c61430c83b3b9d556dd","path":"_posts/fisica/2019-10-04-spazio-stati-quantistici.md"}}