{"dimension_presence":{"decisional":{"observation_count":2,"status":"observed"},"epistemic":{"observation_count":2,"status":"observed"},"rhetorical":{"observation_count":2,"status":"observed"},"semantic":{"observation_count":2,"status":"observed"}},"measurements":{"advanced_stylometry":{"reason_code":"OUT_OF_SCOPE_V1","status":"not_computed","value":null},"nonblank_lines":64,"scope":"raw_markdown_body","unicode_code_points":8378,"utf8_bytes":8434},"method":{"instructions_hash":"6fb281e871a48583b9ed9d9780973f2997e27d00cd11ecbcbb509f2af6ed5c22","instructions_version":"author-extractor/1.1","measurement_version":"raw-body-counts/1","prepare_version":"prepare/1","schema_hash":"063c71461104299b4cfae449d1c32f24642c76fcfe0d9a8340a7023a48fa1047","segmentation_version":"raw-blank-lines/1"},"observations":[{"description":"The opening frames Lagrange's equations as a starting point for classical dynamics by analogy with Maxwell's laws in electromagnetism.","dimension":"rhetorical","evidence":[{"article_id":"A06","passage_id":"P0001","quote":"All'atto pratico, come l'elettromagnetismo parte dalle leggi di Maxwell, la dinamica classica parte dalle equazioni di Lagrange"}],"id":"A06::O0001","inference_kind":"explicit","label":"Opening disciplinary analogy","review_status":"unreviewed"},{"description":"The colloquial first-person plural presents the difficulty of the formalism as a burden shared with the reader.","dimension":"rhetorical","evidence":[{"article_id":"A06","passage_id":"P0002","quote":"Quindi ci tocca sbatterci un po' la testa, temo."}],"id":"A06::O0002","inference_kind":"inferred","label":"Shared-difficulty framing","review_status":"unreviewed"},{"description":"The article explicitly assumes a constant mass in its discussion of the kinetic-energy theorem.","dimension":"epistemic","evidence":[{"article_id":"A06","passage_id":"P0029","quote":"Ovviamente stiamo assumendo che (come avviene nella stragrande maggioranza dei casi) la massa _m_ sia costante"}],"id":"A06::O0003","inference_kind":"explicit","label":"Constant-mass assumption","review_status":"unreviewed"},{"description":"The article invokes classical determinism to state that, given a force, each solution of Newton's equation is uniquely identified by the system's initial conditions.","dimension":"epistemic","evidence":[{"article_id":"A06","passage_id":"P0013","quote":"Il __principio di determinismo__ che regola la meccanica classica ci consente di scrivere che, assegnata una forza _F_, ogni soluzione dell'equazione di Newton è univocamente individuata dalle condizioni iniziali del sistema."}],"id":"A06::O0004","inference_kind":"explicit","label":"Initial-condition determinism","review_status":"unreviewed"},{"description":"The article defines a positional force as one depending only on the spatial position where it is applied.","dimension":"semantic","evidence":[{"article_id":"A06","passage_id":"P0030","quote":"Supponiamo che sul corpo agisca una __forza posizionale__; non, quindi, una generica forza  $$ F(x, v, t) $$, ma una forza che dipende solo dalla posizione nello spazio in cui è applicata $$ F = F(x) $$."}],"id":"A06::O0005","inference_kind":"explicit","label":"Positional-force definition","review_status":"unreviewed"},{"description":"The article calls dynamic variables invariant with respect to a motion in an inertial system constants of motion.","dimension":"semantic","evidence":[{"article_id":"A06","passage_id":"P0053","quote":"Le variabili dinamiche che godono di questa proprietà di invarianza rispetto a un movimento (in un sistema inerziale) sono dette __costanti di moto__."}],"id":"A06::O0006","inference_kind":"explicit","label":"Constants-of-motion definition","review_status":"unreviewed"},{"description":"The article explicitly declines to develop the Cauchy-Kowalewska theorem further in this treatment.","dimension":"decisional","evidence":[{"article_id":"A06","passage_id":"P0016","quote":"È il teorema di Cauchy-Kowalewska, ma avrò pietà e non lo approfondiremo in questa sede."}],"id":"A06::O0007","inference_kind":"explicit","label":"Theorem-detail omission","review_status":"unreviewed"},{"description":"The article asks readers to regard its formal treatment as preparation for understanding concepts introduced later.","dimension":"decisional","evidence":[{"article_id":"A06","passage_id":"P0059","quote":"Prendete, quindi, questo articolo come un ostico, ma utile, approfondimento formale per meglio capire i concetti che verranno in seguito."}],"id":"A06::O0008","inference_kind":"explicit","label":"Preparatory formal treatment","review_status":"unreviewed"}],"processing":{"passages_failed":null,"passages_processed":null,"passages_total":59,"passages_with_observations":8,"status":"not_tracked"},"schema_version":"author-extraction/1.1","source":{"article_id":"A06","corpus_hash":"31ab2684da116696a53686fafa0dbe0adee6d6a3532d50ce4bde03e89cdc7d40","file_hash":"1fc22cef0a81ad397e0616f3633ae1ff326d8960271d240283144594d61c8762","path":"_posts/fisica/2019-11-06-teorema-energia-cinetica.md"}}