{"dimension_presence":{"decisional":{"observation_count":2,"status":"observed"},"epistemic":{"observation_count":2,"status":"observed"},"rhetorical":{"observation_count":2,"status":"observed"},"semantic":{"observation_count":2,"status":"observed"}},"measurements":{"advanced_stylometry":{"reason_code":"OUT_OF_SCOPE_V1","status":"not_computed","value":null},"nonblank_lines":35,"scope":"raw_markdown_body","unicode_code_points":5180,"utf8_bytes":5219},"method":{"instructions_hash":"6fb281e871a48583b9ed9d9780973f2997e27d00cd11ecbcbb509f2af6ed5c22","instructions_version":"author-extractor/1.1","measurement_version":"raw-body-counts/1","prepare_version":"prepare/1","schema_hash":"063c71461104299b4cfae449d1c32f24642c76fcfe0d9a8340a7023a48fa1047","segmentation_version":"raw-blank-lines/1"},"observations":[{"description":"The article introduces a die-roll system as an example following its account of Boolean logic.","dimension":"rhetorical","evidence":[{"article_id":"A04","passage_id":"P0002","quote":"Facciamo un esempio."},{"article_id":"A04","passage_id":"P0003","quote":"Supponiamo di avere il sistema _Lancio di un dado_."}],"id":"A04::O0001","inference_kind":"explicit","label":"Die-roll example","review_status":"unreviewed"},{"description":"The article repeats its quantum experiment with B checked first.","dimension":"rhetorical","evidence":[{"article_id":"A04","passage_id":"P0028","quote":"Ripetiamo l'esperimento, verificando stavolta prima B."}],"id":"A04::O0002","inference_kind":"explicit","label":"Reversed-order repetition","review_status":"unreviewed"},{"description":"The article represents the proposition selecting even die results as a subset of D.","dimension":"semantic","evidence":[{"article_id":"A04","passage_id":"P0006","quote":"Una possibile proposizione potrebbe essere: _\"Tutti i risultati pari\"_, che rappresenta un sottoinsieme dell'insieme D."}],"id":"A04::O0003","inference_kind":"explicit","label":"Proposition as subset","review_status":"unreviewed"},{"description":"The article expresses the logical AND of even results and results greater than three as the intersection of P and T.","dimension":"semantic","evidence":[{"article_id":"A04","passage_id":"P0013","quote":"Per esempio la proposizione _\"Tutti i risultati pari e maggiori di tre\"_, ovvero l'operazione di __AND__ logico, può essere espresso come operazione di intersezione tra P e T, ovvero:"}],"id":"A04::O0004","inference_kind":"explicit","label":"Logical AND as intersection","review_status":"unreviewed"},{"description":"The quantum OR example assumes that the system has been prepared in the up state.","dimension":"epistemic","evidence":[{"article_id":"A04","passage_id":"P0025","quote":"Supponiamo che il sistema sia stato preparato nello stato di _up_ e di voler misurare l'OR logico."}],"id":"A04::O0005","inference_kind":"explicit","label":"Assumed initial state","review_status":"unreviewed"},{"description":"The article qualifies its quantum discussion by stating that some pairs of quantities can be measured simultaneously to yield a fully defined proposition truth table.","dimension":"epistemic","evidence":[{"article_id":"A04","passage_id":"P0032","quote":"In un sistema quantistico _esistono_ coppie di grandezze che possono essere misurate contemporaneamente, per restituire una tabella di verità di una proposizione perfettamente definita, come in un sistema classico."}],"id":"A04::O0006","inference_kind":"explicit","label":"Qualification by compatible quantities","review_status":"unreviewed"},{"description":"In the A-first experiment, the article permits stopping once A has verified the OR expression.","dimension":"decisional","evidence":[{"article_id":"A04","passage_id":"P0027","quote":"Supponiamo di iniziare la verifica di A. Poiché, per ipotesi, il sistema è nello stato di _up_, la misura di $$ \\sigma_z $$ darà come valore misurato 1, il che è sufficiente per verificare la veridicità di A e, quindi, dell'intera espressione (A OR B è vera se A _oppure_ B sono vere). Possiamo fermarci qui."}],"id":"A04::O0007","inference_kind":"explicit","label":"Stopping after verification of A","review_status":"unreviewed"},{"description":"In the B-first experiment, the article requires checking A because it deems the measurement of B insufficient to verify the OR expression.","dimension":"decisional","evidence":[{"article_id":"A04","passage_id":"P0028","quote":"Quindi, la sola misura di B _non è sufficiente_ per verificare l'espressione _A OR B_ e bisogna verificare anche A."}],"id":"A04::O0008","inference_kind":"explicit","label":"Additional verification after B","review_status":"unreviewed"}],"processing":{"passages_failed":null,"passages_processed":null,"passages_total":33,"passages_with_observations":8,"status":"not_tracked"},"schema_version":"author-extraction/1.1","source":{"article_id":"A04","corpus_hash":"31ab2684da116696a53686fafa0dbe0adee6d6a3532d50ce4bde03e89cdc7d40","file_hash":"e17507a9be15e98e63707400e8c4b6c6aa1c35e1d97fde6df4f78e0ed903ffcc","path":"_posts/fisica/2019-09-18-logica-quantistica.md"}}