{"dimension_presence":{"decisional":{"observation_count":2,"status":"observed"},"epistemic":{"observation_count":1,"status":"observed"},"rhetorical":{"observation_count":3,"status":"observed"},"semantic":{"observation_count":2,"status":"observed"}},"measurements":{"advanced_stylometry":{"reason_code":"OUT_OF_SCOPE_V1","status":"not_computed","value":null},"nonblank_lines":89,"scope":"raw_markdown_body","unicode_code_points":14358,"utf8_bytes":14427},"method":{"instructions_hash":"6fb281e871a48583b9ed9d9780973f2997e27d00cd11ecbcbb509f2af6ed5c22","instructions_version":"author-extractor/1.1","measurement_version":"raw-body-counts/1","prepare_version":"prepare/1","schema_hash":"063c71461104299b4cfae449d1c32f24642c76fcfe0d9a8340a7023a48fa1047","segmentation_version":"raw-blank-lines/1"},"observations":[{"description":"The article explicitly prioritizes conceptual intuition for social-network analysis over a rigorous linear-algebra treatment.","dimension":"epistemic","evidence":[{"article_id":"A01","passage_id":"P0002","quote":"Senza la pretesa di fornire una trattazione rigorosa sull'argomento come se dovessimo preparare un esame di algebra lineare, qui ci concentreremo sull'intuizione dei concetti fondamentali così da avere tutte le conoscenze necessarie per utilizzarli in ambito di analisi delle reti sociali."}],"id":"A01::O0001","inference_kind":"explicit","label":"Intuition-oriented scope","review_status":"unreviewed"},{"description":"The opening appears to establish common ground by presenting eigenvectors and eigenvalues as a likely shared learning experience.","dimension":"rhetorical","evidence":[{"article_id":"A01","passage_id":"P0001","quote":"Lo studio degli autovettori e dei corrispondenti autovalori è un qualcosa in cui ci siamo cimentati probabilmente tutti almeno una volta nella vita."}],"id":"A01::O0002","inference_kind":"inferred","label":"Shared-familiarity opening","review_status":"unreviewed"},{"description":"The article introduces its information-compression application with a question about the preceding material's usefulness.","dimension":"rhetorical","evidence":[{"article_id":"A01","passage_id":"P0059","quote":"Ma a cosa serve tutto ciò?"},{"article_id":"A01","passage_id":"P0060","quote":"## Una applicazione pratica: la compressione dell'informazione"}],"id":"A01::O0003","inference_kind":"explicit","label":"Practical-use question","review_status":"unreviewed"},{"description":"The article glosses normalized eigenvectors as having unit magnitude.","dimension":"semantic","evidence":[{"article_id":"A01","passage_id":"P0035","quote":"autovettori __normalizzati__ (cioè con modulo pari a uno)"}],"id":"A01::O0004","inference_kind":"explicit","label":"Normalization gloss","review_status":"unreviewed"},{"description":"The article names its demonstrated operation information compression.","dimension":"semantic","evidence":[{"article_id":"A01","passage_id":"P0079","quote":"Nella pratica, abbiamo condotto una operazione di __compressione dell'informazione__."}],"id":"A01::O0005","inference_kind":"explicit","label":"Compression designation","review_status":"unreviewed"},{"description":"In the compression example, the article chooses to discard the third eigenvalue after describing its information contribution as very small relative to the other two.","dimension":"decisional","evidence":[{"article_id":"A01","passage_id":"P0067","quote":"Questo significa che il suo contributo all'informazione contenuta in"},{"article_id":"A01","passage_id":"P0067","quote":"è molto ridotto, rispetto agli altri due."},{"article_id":"A01","passage_id":"P0068","quote":"Decidiamo allora di _scartarlo_"}],"id":"A01::O0006","inference_kind":"explicit","label":"Small-eigenvalue removal","review_status":"unreviewed"},{"description":"In the compression example, the article also chooses to discard the eigenvector corresponding to the discarded eigenvalue.","dimension":"decisional","evidence":[{"article_id":"A01","passage_id":"P0068","quote":"e di scartare anche l'autovettore corrispondente."}],"id":"A01::O0007","inference_kind":"explicit","label":"Corresponding-eigenvector removal","review_status":"unreviewed"},{"description":"The final reference to Google appears to underscore the practical relevance of the article's introductory concepts.","dimension":"rhetorical","evidence":[{"article_id":"A01","passage_id":"P0084","quote":"È la modalità, infatti, su cui Google ha costruito il suo famigerato algoritmo _PageRank_, per stimare l'autorevolezza e ordinare i link nei risultati del motore di ricerca."},{"article_id":"A01","passage_id":"P0085","quote":"Esatto, Google. E parte tutto da qui."}],"id":"A01::O0008","inference_kind":"inferred","label":"Google-based closing emphasis","review_status":"unreviewed"}],"processing":{"passages_failed":null,"passages_processed":null,"passages_total":85,"passages_with_observations":10,"status":"not_tracked"},"schema_version":"author-extraction/1.1","source":{"article_id":"A01","corpus_hash":"31ab2684da116696a53686fafa0dbe0adee6d6a3532d50ce4bde03e89cdc7d40","file_hash":"c4a106a217100d67de82a3962637f52a3cf08892531d754d50d3ac01bf18f526","path":"_posts/reti-sociali/2018-07-13-introduzione-autovettori-autovalori.md"}}