{"dimension_presence":{"decisional":{"observation_count":2,"status":"observed"},"epistemic":{"observation_count":2,"status":"observed"},"rhetorical":{"observation_count":2,"status":"observed"},"semantic":{"observation_count":2,"status":"observed"}},"measurements":{"advanced_stylometry":{"reason_code":"OUT_OF_SCOPE_V1","status":"not_computed","value":null},"nonblank_lines":48,"scope":"raw_markdown_body","unicode_code_points":15415,"utf8_bytes":15536},"method":{"instructions_hash":"6fb281e871a48583b9ed9d9780973f2997e27d00cd11ecbcbb509f2af6ed5c22","instructions_version":"author-extractor/1.1","measurement_version":"raw-body-counts/1","prepare_version":"prepare/1","schema_hash":"063c71461104299b4cfae449d1c32f24642c76fcfe0d9a8340a7023a48fa1047","segmentation_version":"raw-blank-lines/1"},"observations":[{"description":"The article compares the elementary connection patterns of social networks to the elementary bases of DNA.","dimension":"rhetorical","evidence":[{"article_id":"A02","passage_id":"P0013","quote":"Così come il DNA è costruito da una sequenza di quattro basi elementari (adenina, guanina,...) così anche le reti sociali hanno le loro \"basi\"."}],"id":"A02::O0001","inference_kind":"explicit","label":"DNA analogy","review_status":"unreviewed"},{"description":"The article frames degree-based assortativity as a question about whether highly connected nodes connect to other highly connected nodes or to sparsely connected nodes.","dimension":"rhetorical","evidence":[{"article_id":"A02","passage_id":"P0031","quote":"i nodi con un elevato numero connessioni tenderanno a collegarsi ad altri nodi con molte connessioni o preferiranno nodi con un basso numero di connessioni?"}],"id":"A02::O0002","inference_kind":"explicit","label":"Question framing","review_status":"unreviewed"},{"description":"The article qualifies the reported break in symmetry between human social networks and other networks as provisional.","dimension":"epistemic","evidence":[{"article_id":"A02","passage_id":"P0003","quote":"una realtà un po' più complessa, che rompe, almeno per ora, la simmetria con neuroni, telefoni e relé"}],"id":"A02::O0003","inference_kind":"explicit","label":"Provisional symmetry contrast","review_status":"unreviewed"},{"description":"The article explicitly limits preferential attachment to some rather than all social networks.","dimension":"epistemic","evidence":[{"article_id":"A02","passage_id":"P0020","quote":"Le reti sociali presentano questa caratteristica, ma non tutte e comunque non tutte le reti"}],"id":"A02::O0004","inference_kind":"explicit","label":"Preferential-attachment qualification","review_status":"unreviewed"},{"description":"The article restricts the scale invariance invoked by the term scale-free to the slope of the regression line built on the centrality distribution.","dimension":"semantic","evidence":[{"article_id":"A02","passage_id":"P0024","quote":"queste reti si chiamano __scale-free__ perché la pendenza della retta caratteristica del modello di regressione costruito sulla distribuzione della centralità è _invariante alla scala_,  cioè non varia al variare del numero dei nodi. Solo, tuttavia, questa grandezza presenta questa caratteristica"}],"id":"A02::O0005","inference_kind":"explicit","label":"Restricted scale invariance","review_status":"unreviewed"},{"description":"The article defines assortative mixing as a network's tendency to favor cohesion between similar nodes.","dimension":"semantic","evidence":[{"article_id":"A02","passage_id":"P0029","quote":"una rete che favorisce la coesione tra nodi affini è una rete soggetta ad _assortative mixing_ (o anche __omofilia__)."}],"id":"A02::O0006","inference_kind":"explicit","label":"Assortative mixing definition","review_status":"unreviewed"},{"description":"The article declines to examine why the triangle is the most elementary unit of social-community organization.","dimension":"decisional","evidence":[{"article_id":"A02","passage_id":"P0014","quote":"Il motivo per cui l'elemento più atomico di organizzazione delle comunità sociali sia il triangolo è ancora oggetto di studi e non vi ci addentreremo in questa sede."}],"id":"A02::O0007","inference_kind":"explicit","label":"Explanatory scope exclusion","review_status":"unreviewed"},{"description":"The article recommends examining the degree distribution of all network nodes to determine whether a network is scale-free.","dimension":"decisional","evidence":[{"article_id":"A02","passage_id":"P0021","quote":"Capire se ci troviamo di fronte a una rete di questo tipo, che per inciso prende il nome di __scale-free__,  non è difficile: basta studiare la distribuzione del grado di tutti i nodi della rete."}],"id":"A02::O0008","inference_kind":"explicit","label":"Degree-distribution diagnostic","review_status":"unreviewed"}],"processing":{"passages_failed":null,"passages_processed":null,"passages_total":38,"passages_with_observations":8,"status":"not_tracked"},"schema_version":"author-extraction/1.1","source":{"article_id":"A02","corpus_hash":"31ab2684da116696a53686fafa0dbe0adee6d6a3532d50ce4bde03e89cdc7d40","file_hash":"aa17751085cea41199a5d7ccbdca7f5de66f4d70b80d9236722c21209f5b9e55","path":"_posts/reti-sociali/2018-07-29-community-network-model.md"}}