{"dimension_presence":{"decisional":{"observation_count":4,"status":"observed"},"epistemic":{"observation_count":2,"status":"observed"},"rhetorical":{"observation_count":1,"status":"observed"},"semantic":{"observation_count":1,"status":"observed"}},"measurements":{"advanced_stylometry":{"reason_code":"OUT_OF_SCOPE_V1","status":"not_computed","value":null},"nonblank_lines":135,"scope":"raw_markdown_body","unicode_code_points":17290,"utf8_bytes":17413},"method":{"instructions_hash":"6fb281e871a48583b9ed9d9780973f2997e27d00cd11ecbcbb509f2af6ed5c22","instructions_version":"author-extractor/1.1","measurement_version":"raw-body-counts/1","prepare_version":"prepare/1","schema_hash":"063c71461104299b4cfae449d1c32f24642c76fcfe0d9a8340a7023a48fa1047","segmentation_version":"raw-blank-lines/1"},"observations":[{"description":"The opening frames automatic lighting compensation as a response to a familiar home-working discomfort.","dimension":"rhetorical","evidence":[{"article_id":"A09","passage_id":"P0001","quote":"Chi lavora da casa conosce il problema: la luce cambia continuamente durante la giornata, e spesso ci si ritrova a lavorare al computer con una illuminazione inadeguata senza rendersene conto."},{"article_id":"A09","passage_id":"P0001","quote":"La soluzione ideale è un sistema che compensi automaticamente la luce naturale con quella artificiale, mantenendo l'illuminamento costante."}],"id":"A09::O0001","inference_kind":"inferred","label":"Everyday-problem framing","review_status":"unreviewed"},{"description":"The article reports rejecting the purchase of physical illuminance sensors because the writer did not want to add devices to an already crowded Zigbee setup.","dimension":"decisional","evidence":[{"article_id":"A09","passage_id":"P0004","quote":"I sensori di illuminanza fisici esistono, costano poco e funzionano bene. Ma non mi andava di acquistarli e di aggiungere altri dispositivi alla mia già piuttosto affollata costellazione Zigbee."}],"id":"A09::O0002","inference_kind":"explicit","label":"Avoidance of additional hardware","review_status":"unreviewed"},{"description":"The article treats linear brightness-to-lumen conversion as an approximation sufficient for this lighting application.","dimension":"epistemic","evidence":[{"article_id":"A09","passage_id":"P0039","quote":"La linearità brightness → lumen è un'approssimazione (i LED non sono perfettamente lineari), ma sufficiente per questo scopo."}],"id":"A09::O0003","inference_kind":"explicit","label":"Purpose-bounded approximation","review_status":"unreviewed"},{"description":"The article distinguishes its feedforward control from closed-loop control by the absence of measured real room illuminance from the corrective calculation.","dimension":"semantic","evidence":[{"article_id":"A09","passage_id":"P0051","quote":"In un vero sistema a ciclo chiuso si misurerebbe l'illuminamento effettivo della stanza con un sensore fisico, si calcolerebbe l'errore rispetto al target, e si userebbe quell'errore per correggere l'intensità delle sorgenti luminose."},{"article_id":"A09","passage_id":"P0051","quote":"Qui invece l'illuminamento reale non è mai misurato e non entra mai nel calcolo (che, poi, era la premessa dell'articolo!): si misura solo la **perturbazione** (la luce naturale stimata), e si usa un **modello del processo** (i lumen noti delle lampade) per calcolare preventivamente l'azione correttiva."},{"article_id":"A09","passage_id":"P0051","quote":"È un controllo **feedforward**: efficiente e senza oscillazioni, ma che non si autocorregge se il modello è impreciso."}],"id":"A09::O0004","inference_kind":"explicit","label":"Feedforward distinction","review_status":"unreviewed"},{"description":"The article reports choosing a default target of 400 lux adjustable through an input_number helper for later fine tuning.","dimension":"decisional","evidence":[{"article_id":"A09","passage_id":"P0050","quote":"Ho scelto 400 lux come target default, regolabile tramite un helper `input_number`, così da facilitare eventuali fine tuning successivi."}],"id":"A09::O0005","inference_kind":"explicit","label":"Adjustable illuminance target","review_status":"unreviewed"},{"description":"The article qualifies with 'credo' its current claim that adding variables remains exclusive to YAML code.","dimension":"epistemic","evidence":[{"article_id":"A09","passage_id":"P0056","quote":"Ad oggi l'aggiunta delle variables è, credo, ancora prerogativa del codice Yaml."}],"id":"A09::O0006","inference_kind":"explicit","label":"Qualified interface claim","review_status":"unreviewed"},{"description":"The article prescribes temporarily disabling Adaptive Lighting's brightness control during smartworking while retaining its color-temperature control.","dimension":"decisional","evidence":[{"article_id":"A09","passage_id":"P0059","quote":"La soluzione è disabilitare temporaneamente il controllo brightness di AL durante le ore di smartworking, lasciandogli solo il controllo della temperatura colore:"}],"id":"A09::O0007","inference_kind":"explicit","label":"Temporary brightness-control suspension","review_status":"unreviewed"},{"description":"The article specifies that Adaptive Lighting resumes full control when working hours end or natural light becomes sufficient.","dimension":"decisional","evidence":[{"article_id":"A09","passage_id":"P0061","quote":"Al termine dell'orario di lavoro, o se la luce naturale diventa sufficiente, AL riprende il controllo completo."}],"id":"A09::O0008","inference_kind":"explicit","label":"Full-control restoration rule","review_status":"unreviewed"}],"processing":{"passages_failed":null,"passages_processed":null,"passages_total":65,"passages_with_observations":8,"status":"not_tracked"},"schema_version":"author-extraction/1.1","source":{"article_id":"A09","corpus_hash":"31ab2684da116696a53686fafa0dbe0adee6d6a3532d50ce4bde03e89cdc7d40","file_hash":"48697f09a962f1f7b0d80042ee057df9900bef3e470f7511222ccf20265787d5","path":"_posts/home-assistant/2026-05-09-illuminanza-smartworking-home-assistant.md"}}