{"dimension_presence":{"decisional":{"observation_count":2,"status":"observed"},"epistemic":{"observation_count":4,"status":"observed"},"rhetorical":{"observation_count":2,"status":"observed"},"semantic":{"observation_count":1,"status":"observed"}},"measurements":{"advanced_stylometry":{"reason_code":"OUT_OF_SCOPE_V1","status":"not_computed","value":null},"nonblank_lines":72,"scope":"raw_markdown_body","unicode_code_points":17823,"utf8_bytes":17949},"method":{"instructions_hash":"6fb281e871a48583b9ed9d9780973f2997e27d00cd11ecbcbb509f2af6ed5c22","instructions_version":"author-extractor/1.1","measurement_version":"raw-body-counts/1","prepare_version":"prepare/1","schema_hash":"063c71461104299b4cfae449d1c32f24642c76fcfe0d9a8340a7023a48fa1047","segmentation_version":"raw-blank-lines/1"},"observations":[{"description":"The article announces clarifying examples before proceeding with the study of the power law.","dimension":"rhetorical","evidence":[{"article_id":"A03","passage_id":"P0005","quote":"Ma prima di addentrarci nello studio della legge di potenza, facciamo alcuni esempi chiarificatori di come si presentano, spesso, le grandezze in natura."}],"id":"A03::O0001","inference_kind":"explicit","label":"Example-first introduction","review_status":"unreviewed"},{"description":"The article qualifies power-law behavior as more commonly applying to portions of a quantity's range than to its entirety.","dimension":"epistemic","evidence":[{"article_id":"A03","passage_id":"P0017","quote":"Tuttavia, molto raramente una grandezza segue una power law sull'_interezza_ delle misure che assume. Più spesso, essa segue questo andamento _a tratti_, mentre in altre regioni il suo andamento segue leggi diverse."}],"id":"A03::O0002","inference_kind":"explicit","label":"Partial-domain qualification","review_status":"unreviewed"},{"description":"The article defines non-linear binning as varying histogram interval sizes according to a constant scheme and normalizing the results to obtain counts per unit of x.","dimension":"semantic","evidence":[{"article_id":"A03","passage_id":"P0024","quote":"Un modo più accurato consiste allora nel _variare la dimensione degli intervalli dell'istogramma con uno schema costante e normalizzare i risultati_, in modo da ottenere un conteggio _per unità di grandezza di x_. Questa operazione si chiama _non-linear binning_."}],"id":"A03::O0003","inference_kind":"explicit","label":"Non-linear binning definition","review_status":"unreviewed"},{"description":"The article states that aggregation within a bin removes the measurements' status as distinct entities.","dimension":"epistemic","evidence":[{"article_id":"A03","passage_id":"P0028","quote":"Per spiegare meglio il concetto: una volta aggregate le misurazioni all'interno di un bin, le abbiamo perse come entità distinte."}],"id":"A03::O0004","inference_kind":"explicit","label":"Aggregation information loss","review_status":"unreviewed"},{"description":"The article presents cumulative probability representation as a better way to represent and study a power law.","dimension":"decisional","evidence":[{"article_id":"A03","passage_id":"P0030","quote":"Fortunatamente esiste un modo ancora migliore per rappresentare (e studiare) una power law e consiste nel rappresentarla mediante la __distribuzione di probabilità cumulativa__ (cumulative distribution function, o __CDF__)."}],"id":"A03::O0005","inference_kind":"explicit","label":"Cumulative representation preference","review_status":"unreviewed"},{"description":"The article defers the treatment of estimator robustness testing to a planned second article.","dimension":"rhetorical","evidence":[{"article_id":"A03","passage_id":"P0051","quote":"Naturalmente, la robustezza di tali stimatori va anche essa valutata con un opportuno test per l'ipotesi, ma per essa vi chiedo di attendere il secondo articolo sull'argomento che ho in lavorazione, che riporterà degli esempi pratici in R e che toccherà anche questi temi ulteriori."}],"id":"A03::O0006","inference_kind":"explicit","label":"Hypothesis-testing deferral","review_status":"unreviewed"},{"description":"The article presents the municipal-population graph's apparent log-normal shape with a possibly power-law right tail as an initial impression.","dimension":"epistemic","evidence":[{"article_id":"A03","passage_id":"P0062","quote":"Ebbene, questo grafico mi ha subito dato la sensazione di un andamento che segue una [distribuzione log-normale](https://it.wikipedia.org/wiki/Distribuzione_lognormale), con una leggera distonia sulla \"coda\" destra che può essere imputabile a un andamento secondo la legge di potenza."}],"id":"A03::O0007","inference_kind":"explicit","label":"Tentative graphical interpretation","review_status":"unreviewed"},{"description":"In the municipal-population example, the article reports fitting both a power-law model and a log-normal model by maximum likelihood on the CDF.","dimension":"decisional","evidence":[{"article_id":"A03","passage_id":"P0063","quote":"Il prossimo passo è stato, perciò, quello di individuare, attraverso il metodo di massima verosimiglianza spiegato sopra, due modelli, uno di tipo _power law_ e uno di tipo log-normale. L'ho fatto, naturalmente, sulla CDF e ho ottenuto il seguente:"}],"id":"A03::O0008","inference_kind":"explicit","label":"Two-model fitting choice","review_status":"unreviewed"},{"description":"For the municipal-population example, the article treats visual inspection as already providing sufficient assurance despite identifying a robustness test as necessary to complete the work.","dimension":"epistemic","evidence":[{"article_id":"A03","passage_id":"P0066","quote":"Ciò che bisognerebbe fare per terminare il lavoro è, come dicevamo, un opportuno test per verificare la robustezza degli stimatori, ma oggettivamente, nel caso specifico l'ispezione visiva dei grafici fornisce già, con discreto margine di sicurezza, le garanzie necessarie."}],"id":"A03::O0009","inference_kind":"explicit","label":"Case-specific visual assurance","review_status":"unreviewed"}],"processing":{"passages_failed":null,"passages_processed":null,"passages_total":68,"passages_with_observations":9,"status":"not_tracked"},"schema_version":"author-extraction/1.1","source":{"article_id":"A03","corpus_hash":"31ab2684da116696a53686fafa0dbe0adee6d6a3532d50ce4bde03e89cdc7d40","file_hash":"8e639a9bdde3dfe42df730b7962242b5cf09a39821652ebc786bd16449d37d33","path":"_posts/reti-sociali/2018-08-12-legge-potenza-powerlaw.md"}}