{"dimension_presence":{"decisional":{"observation_count":3,"status":"observed"},"epistemic":{"observation_count":2,"status":"observed"},"rhetorical":{"observation_count":2,"status":"observed"},"semantic":{"observation_count":2,"status":"observed"}},"measurements":{"advanced_stylometry":{"reason_code":"OUT_OF_SCOPE_V1","status":"not_computed","value":null},"nonblank_lines":182,"scope":"raw_markdown_body","unicode_code_points":12963,"utf8_bytes":13041},"method":{"instructions_hash":"6fb281e871a48583b9ed9d9780973f2997e27d00cd11ecbcbb509f2af6ed5c22","instructions_version":"author-extractor/1.1","measurement_version":"raw-body-counts/1","prepare_version":"prepare/1","schema_hash":"063c71461104299b4cfae449d1c32f24642c76fcfe0d9a8340a7023a48fa1047","segmentation_version":"raw-blank-lines/1"},"observations":[{"description":"The article introduces the project's origin through a first-person question about checking the Moon's phase from a Home Assistant dashboard.","dimension":"rhetorical","evidence":[{"article_id":"A10","passage_id":"P0001","quote":"Tutto è partito da una domanda banale: *posso sapere dalla mia dashboard di Home Assistant in che fase è la Luna stasera?*"}],"id":"A10::O0001","inference_kind":"explicit","label":"Opening project-origin question","review_status":"unreviewed"},{"description":"The date-format discussion frames the template sensor as a response to a specific integration obstacle.","dimension":"rhetorical","evidence":[{"article_id":"A10","passage_id":"P0018","quote":"Il problema è il formato della data: l'API si aspetta `2026-05-10T14:00`, ma i template Jinja2 di HA hanno `now()` che restituisce un oggetto datetime completo. Serve un passo intermedio."},{"article_id":"A10","passage_id":"P0020","quote":"Creo un **template sensor** che formatta la data corrente nel formato esatto richiesto dall'API:"}],"id":"A10::O0002","inference_kind":"inferred","label":"Problem-to-implementation transition","review_status":"unreviewed"},{"description":"The article explicitly excludes professional astronomers as the project's intended audience.","dimension":"epistemic","evidence":[{"article_id":"A10","passage_id":"P0002","quote":"Non è un progetto per astronomi professionisti e il suo scopo è sicuramente divulgativo, in particolare per incuriosire i miei due bambini."}],"id":"A10::O0003","inference_kind":"explicit","label":"Nonprofessional project scope","review_status":"unreviewed"},{"description":"The article presents usefulness for astronomy enthusiasts and casual observers as a possibility rather than a guaranteed outcome.","dimension":"epistemic","evidence":[{"article_id":"A10","passage_id":"P0002","quote":"Tuttavia, non è nemmeno del tutto inutile: astrofili, appassionati di astrofotografia, o semplicemente chi vuole sapere se stasera vale la pena alzare lo sguardo potrebbero trovarvi informazioni utili."}],"id":"A10::O0004","inference_kind":"inferred","label":"Qualified audience usefulness","review_status":"unreviewed"},{"description":"The article glosses its astrometry dashboard as a screen devoted to events overhead, ranging from lunar cycles to space launches.","dimension":"semantic","evidence":[{"article_id":"A10","passage_id":"P0002","quote":"Quello che descrivo in questa serie di articoli è una dashboard di **astrometria** — una parola un po' altisonante per dire: uno schermo dedicato a tutto quello che succede sopra la nostra testa, dai cicli lunari all'attività solare, dalle aurore boreali ai prossimi lanci spaziali."}],"id":"A10::O0005","inference_kind":"explicit","label":"Accessible astrometry gloss","review_status":"unreviewed"},{"description":"The article characterizes the composed lunar-phase sensor as an aggregator that reads existing sensors rather than querying external APIs.","dimension":"semantic","evidence":[{"article_id":"A10","passage_id":"P0053","quote":"- **Relazione con gli altri sensori**: questo sensore è un *aggregatore* — non interroga API esterne, si limita a leggere `sensor.moon_phase` (nativo) e `sensor.nasa_moon_phase_info` (REST)."}],"id":"A10::O0006","inference_kind":"explicit","label":"Aggregator definition","review_status":"unreviewed"},{"description":"The article specifies direct current-time formatting in the REST resource template when the date sensor is unavailable at startup.","dimension":"decisional","evidence":[{"article_id":"A10","passage_id":"P0027","quote":"- **Il fallback**: se il sensore della data non è ancora disponibile al boot, uso `now().strftime(...)` direttamente nella `resource_template`."}],"id":"A10::O0007","inference_kind":"explicit","label":"Startup timestamp fallback","review_status":"unreviewed"},{"description":"The article chooses to retain the complete image object as a sensor attribute to allow future access to API fields without configuration changes.","dimension":"decisional","evidence":[{"article_id":"A10","passage_id":"P0027","quote":"- **`json_attributes: [image]`**: salvo l'intero oggetto `image` come attributo del sensore, non solo l'URL. Questo mi permette di accedere a tutti i campi restituiti dall'API in futuro senza modificare la configurazione."}],"id":"A10::O0008","inference_kind":"explicit","label":"Complete image-object retention","review_status":"unreviewed"},{"description":"The article presents the card's internal lunar-phase calculation as redundancy against NASA API unavailability.","dimension":"decisional","evidence":[{"article_id":"A10","passage_id":"P0046","quote":"`use_default: true` dice alla card di calcolare autonomamente la fase senza affidarsi a un sensore esterno — il che la rende indipendente dal REST sensor NASA e dal sensore `moon`. Questo è utile per avere ridondanza: anche se l'API NASA fosse irraggiungibile, la card continua a mostrare la fase calcolata internamente."}],"id":"A10::O0009","inference_kind":"explicit","label":"Independent phase-calculation redundancy","review_status":"unreviewed"}],"processing":{"passages_failed":null,"passages_processed":null,"passages_total":56,"passages_with_observations":7,"status":"not_tracked"},"schema_version":"author-extraction/1.1","source":{"article_id":"A10","corpus_hash":"31ab2684da116696a53686fafa0dbe0adee6d6a3532d50ce4bde03e89cdc7d40","file_hash":"1bb94efcf926611d640b9fe1ee41007005d89019103a49f9001630105119b775","path":"_posts/home-assistant/2026-05-10-dashboard-astrometria-parte-1.md"}}